{
  "$schema": "http://json-schema.org/draft-07/schema",
  "description": "TESTR rules schema v1.0",
  "required": ["game", "components", "setup", "turn_structure", "actions", "win_conditions"],
  "properties": {
    "game": {
      "description": "Game metadata",
      "required": ["name", "version"],
      "properties": {
        "name":        { "type": "string", "description": "Full game title" },
        "version":     { "type": "string", "description": "Rules version (semver recommended)" },
        "description": { "type": "string", "description": "1-2 sentence description for agents" },
        "player_count": {
          "properties": {
            "min":     { "type": "integer" },
            "max":     { "type": "integer" },
            "default": { "type": "integer", "description": "Used by CLI if not specified" }
          }
        }
      }
    },

    "components": {
      "description": "Physical components of the game",
      "type": "array",
      "items": {
        "required": ["name", "type"],
        "properties": {
          "name":        { "type": "string" },
          "type":        { "enum": ["card_deck", "token", "die", "tile", "counter", "board", "other"] },
          "count":       { "type": "integer", "description": "Number of this component" },
          "values":      { "type": "array",   "description": "Possible values (e.g. card faces, die sides)" },
          "per_player":  { "type": "boolean", "description": "If true, each player has their own copy" },
          "description": { "type": "string" }
        }
      }
    },

    "initial_state": {
      "description": "Starting values for tracked game state. All keys are optional.",
      "properties": {
        "flags":  { "type": "object", "description": "Named boolean or string flags (e.g. {\"first_player_bonus_available\": true})" },
        "scores": { "type": "object", "description": "Starting scores per player. Defaults to 0 for all if omitted." },
        "custom": { "type": "object", "description": "Any other state the referee needs to track (e.g. hand sizes, deck counts)" }
      }
    },

    "setup": {
      "description": "Ordered steps to set up the game before play begins",
      "type": "array",
      "items": {
        "required": ["step", "description"],
        "properties": {
          "step":        { "type": "integer" },
          "description": { "type": "string", "description": "Plain-language instruction" }
        }
      }
    },

    "turn_structure": {
      "description": "Ordered phases within a single player's turn",
      "type": "array",
      "items": {
        "required": ["name", "description"],
        "properties": {
          "name":        { "type": "string" },
          "description": { "type": "string" },
          "optional":    { "type": "boolean", "default": false }
        }
      }
    },

    "actions": {
      "description": "Discrete actions a player may take. The referee validates all actions against these definitions.",
      "type": "array",
      "items": {
        "required": ["type", "description"],
        "properties": {
          "type":               { "type": "string",  "description": "Snake_case identifier used in agent JSON responses" },
          "description":        { "type": "string",  "description": "What this action does, in plain language" },
          "conditions":         { "type": "array",   "items": { "type": "string" }, "description": "Preconditions that must be true for this action to be legal" },
          "effects":            { "type": "array",   "items": { "type": "string" }, "description": "What changes in game state when this action is taken" },
          "parameters":         { "type": "array",   "items": { "type": "string" }, "description": "Named inputs required (e.g. [\"card_id\", \"target_player\"])" },
          "triggers_reactions": { "type": "boolean", "default": false, "description": "If true, all other players are queried for a reaction after this action resolves. Used for attacks and similar interrupts." },
          "reaction":           { "type": "boolean", "default": false, "description": "If true, this action is only available as a reaction to a triggers_reactions action, never during the active player's normal turn." }
        }
      }
    },

    "win_conditions": {
      "description": "Conditions that end the game. Evaluated after each turn.",
      "type": "array",
      "items": {
        "required": ["type", "description"],
        "properties": {
          "type":        { "enum": ["score_threshold", "flag", "turn_limit", "elimination", "custom"] },
          "description": { "type": "string", "description": "Human-readable explanation" },
          "threshold":   { "type": "integer", "description": "For score_threshold: score value that triggers win" },
          "flag":        { "type": "string",  "description": "For flag: which flag key to check" },
          "value":       {                    "description": "For flag: the value the flag must equal" },
          "limit":       { "type": "integer", "description": "For turn_limit: total turns before game ends" }
        }
      }
    },

    "edge_cases": {
      "description": "Special rulings the referee should apply when standard action rules are ambiguous",
      "type": "array",
      "items": {
        "required": ["situation", "ruling"],
        "properties": {
          "situation": { "type": "string", "description": "Describe the ambiguous or exceptional situation" },
          "ruling":    { "type": "string", "description": "The correct resolution, stated unambiguously" },
          "notes":     { "type": "string", "description": "Optional context or reasoning" }
        }
      }
    }
  }
}
