{
  "game": {
    "name": "Example: High Card",
    "version": "1.0.0",
    "description": "A simple 2-player card game. Each turn a player plays a card from their hand; highest card wins the round. First to 5 round wins takes the game.",
    "player_count": { "min": 2, "max": 2, "default": 2 }
  },

  "components": [
    {
      "name": "Standard deck",
      "type": "card_deck",
      "count": 52,
      "description": "52-card standard deck, suits ignored. Cards ranked 2–14 (Ace high)."
    }
  ],

  "initial_state": {
    "flags": {
      "deck_exhausted": false
    },
    "scores": {
      "Player 1": 0,
      "Player 2": 0
    },
    "custom": {
      "Player 1_hand": [],
      "Player 2_hand": []
    }
  },

  "setup": [
    { "step": 1, "description": "Shuffle the deck." },
    { "step": 2, "description": "Deal 5 cards to each player face-down. Players may look at their own hand." },
    { "step": 3, "description": "Randomly determine which player goes first." }
  ],

  "turn_structure": [
    {
      "name": "Play card",
      "description": "The active player selects one card from their hand and plays it face-up to the table."
    },
    {
      "name": "Reveal & resolve",
      "description": "Both players reveal their played card. The player with the higher card wins 1 point. Ties award no points."
    }
  ],

  "actions": [
    {
      "type": "play_card",
      "description": "Play one card from your hand face-up.",
      "conditions": [
        "The player must have at least one card in hand."
      ],
      "effects": [
        "The chosen card is removed from the player's hand.",
        "The card value is compared to the opponent's played card.",
        "The player with the higher value gains 1 point. Ties score nothing."
      ],
      "parameters": ["card_value"]
    }
  ],

  "win_conditions": [
    {
      "type": "score_threshold",
      "description": "First player to reach 5 round wins takes the game.",
      "threshold": 5
    },
    {
      "type": "turn_limit",
      "description": "If all cards are exhausted with no winner, the player with more points wins. Tiebreaker: neither player wins (draw).",
      "limit": 5
    }
  ],

  "edge_cases": [
    {
      "situation": "Both players play a card of equal value on the same turn.",
      "ruling": "Neither player scores a point. Both cards are discarded. Play continues.",
      "notes": "This is the only way a turn ends with no score change."
    },
    {
      "situation": "A player has no cards left in hand but the game has not ended.",
      "ruling": "The game ends immediately. The player with the higher score wins.",
      "notes": "Should not occur in normal play with the turn limit, but included as a safety ruling."
    }
  ]
}
